{
  "success": true,
  "parser_version": "2.3.0",
  "bank_name": "State Bank of India",
  "account_info": {
    "account_number": "XXXXXXX0193",
    "ifsc": "sbin0001234",
    "opening_balance": "2,500.00 Dr",
    "closing_balance": "6,550.00"
  },
  "account_number": "XXXXXXX0193",
  "ifsc": "SBIN0001234",
  "opening_balance": "2,500.00 Dr",
  "closing_balance": "6,550.00",
  "total_transactions": 5,
  "period": "01/05/2025 to 31/05/2025",
  "period_from": "2025-05-01",
  "period_to": "2025-05-31",
  "pages": {
    "seen": 2,
    "stated": 2
  },
  "read_by": "ocr",
  "parsed_by": "structured",
  "verification": {
    "matched": 1,
    "total": 1,
    "percent": 100.0
  },
  "filled": {
    "balances": 3,
    "amounts": 1
  },
  "transactions": [
    {
      "seq": 1,
      "date": "02-05-2025",
      "particulars": "BY TRANSFER-NEFT",
      "chq_ref": "UTR998877",
      "withdrawal": "",
      "deposit": "10,000.00",
      "balance": "7,500.00",
      "value_date": "02-05-2025"
    },
    {
      "seq": 2,
      "date": "10-05-2025",
      "particulars": "ATM WDL",
      "chq_ref": "",
      "withdrawal": "1,000.00",
      "deposit": "",
      "balance": "6500.00",
      "balance_source": "computed"
    },
    {
      "seq": 3,
      "date": "15-05-2025",
      "particulars": "BALANCE CARRIED",
      "chq_ref": "",
      "withdrawal": "",
      "deposit": "",
      "balance": "6500.00",
      "balance_source": "computed"
    },
    {
      "seq": 4,
      "date": "20-05-2025",
      "particulars": "INTEREST",
      "chq_ref": "",
      "withdrawal": "",
      "deposit": "50.00",
      "balance": "6,550.00",
      "amount_source": "inferred"
    },
    {
      "seq": 5,
      "date": "31-05-2025",
      "particulars": "CLOSING",
      "chq_ref": "",
      "withdrawal": "",
      "deposit": "",
      "balance": "6550.00",
      "balance_source": "computed"
    }
  ],
  "preview": [],
  "warnings": [
    "Page 2 was read by OCR",
    "3 balance(s) were not printed: the parser computed them from the balance before and the amounts (balance_source: computed)",
    "1 amount(s) were not printed: the parser inferred them from the balance movement (amount_source: inferred)"
  ],
  "ocr_corrections": []
}
